smartctl 6.5 2016-01-24 r4214 [x86_64-linux-4.4.0-31-generic] (local build)
Copyright (C) 2002-16, Bruce Allen, Christian Franke, www.smartmontools.org

/dev/sda: Unknown USB bridge [0x18a5:0x0302 (0x100)]
Please specify device type with the -d option.

Use smartctl -h to get a usage summary

smartctl 6.5 2016-01-24 r4214 [x86_64-linux-4.4.0-31-generic] (local build)
Copyright (C) 2002-16, Bruce Allen, Christian Franke, www.smartmontools.org

=== START OF INFORMATION SECTION ===
Vendor:               Verbatim
Product:              STORE N GO
Revision:             PMAP
User Capacity:        7,746,879,488 bytes [7.74 GB]
Logical block size:   512 bytes
scsiModePageOffset: response length too short, resp_len=4 offset=4 bd_len=0
scsiModePageOffset: response length too short, resp_len=4 offset=4 bd_len=0
>> Terminate command early due to bad response to IEC mode page
A mandatory SMART command failed: exiting. To continue, add one or more '-T permissive' options.
smartctl 6.5 2016-01-24 r4214 [x86_64-linux-4.4.0-31-generic] (local build)
Copyright (C) 2002-16, Bruce Allen, Christian Franke, www.smartmontools.org

=== START OF INFORMATION SECTION ===
Vendor:               Verbatim
Product:              STORE N GO
Revision:             PMAP
User Capacity:        7,746,879,488 bytes [7.74 GB]
Logical block size:   512 bytes
scsiModePageOffset: response length too short, resp_len=4 offset=4 bd_len=0
scsiModePageOffset: response length too short, resp_len=4 offset=4 bd_len=0
>> Terminate command early due to bad response to IEC mode page
A mandatory SMART command failed: exiting. To continue, add one or more '-T permissive' options.
smartctl 6.5 2016-01-24 r4214 [x86_64-linux-4.4.0-31-generic] (local build)
Copyright (C) 2002-16, Bruce Allen, Christian Franke, www.smartmontools.org

=== START OF INFORMATION SECTION ===
Vendor:               Verbatim
Product:              STORE N GO
Revision:             PMAP
User Capacity:        7,746,879,488 bytes [7.74 GB]
Logical block size:   512 bytes
scsiModePageOffset: response length too short, resp_len=4 offset=4 bd_len=0
scsiModePageOffset: response length too short, resp_len=4 offset=4 bd_len=0
>> Terminate command early due to bad response to IEC mode page
A mandatory SMART command failed: exiting. To continue, add one or more '-T permissive' options.
smartctl 6.5 2016-01-24 r4214 [x86_64-linux-4.4.0-31-generic] (local build)
Copyright (C) 2002-16, Bruce Allen, Christian Franke, www.smartmontools.org

=== START OF INFORMATION SECTION ===
Model Family:     Fujitsu MHZ BJ
Device Model:     FUJITSU MHZ2160BJ G1
Serial Number:    K84BTA12C2NS
LU WWN Device Id: 5 00000e 04467f5cb
Firmware Version: 00840023
User Capacity:    160,041,885,696 bytes [160 GB]
Sector Size:      512 bytes logical/physical
Rotation Rate:    7200 rpm
Device is:        In smartctl database [for details use: -P show]
ATA Version is:   ATA8-ACS T13/1699-D revision 3f
SATA Version is:  SATA 2.6, 1.5 Gb/s (current: 1.5 Gb/s)
Local Time is:    Fri Dec  9 17:09:30 2016 CET
SMART support is: Available - device has SMART capability.
SMART support is: Enabled

=== START OF READ SMART DATA SECTION ===
SMART overall-health self-assessment test result: PASSED

General SMART Values:
Offline data collection status:  (0x00)	Offline data collection activity
					was never started.
					Auto Offline Data Collection: Disabled.
Self-test execution status:      (   0)	The previous self-test routine completed
					without error or no self-test has ever 
					been run.
Total time to complete Offline 
data collection: 		(  526) seconds.
Offline data collection
capabilities: 			 (0x7b) SMART execute Offline immediate.
					Auto Offline data collection on/off support.
					Suspend Offline collection upon new
					command.
					Offline surface scan supported.
					Self-test supported.
					Conveyance Self-test supported.
					Selective Self-test supported.
SMART capabilities:            (0x0003)	Saves SMART data before entering
					power-saving mode.
					Supports SMART auto save timer.
Error logging capability:        (0x01)	Error logging supported.
					General Purpose Logging supported.
Short self-test routine 
recommended polling time: 	 (   2) minutes.
Extended self-test routine
recommended polling time: 	 (  72) minutes.
Conveyance self-test routine
recommended polling time: 	 (   2) minutes.
SCT capabilities: 	       (0x003d)	SCT Status supported.
					SCT Error Recovery Control supported.
					SCT Feature Control supported.
					SCT Data Table supported.

SMART Attributes Data Structure revision number: 16
Vendor Specific SMART Attributes with Thresholds:
ID# ATTRIBUTE_NAME          FLAG     VALUE WORST THRESH TYPE      UPDATED  WHEN_FAILED RAW_VALUE
  1 Raw_Read_Error_Rate     0x000f   100   100   046    Pre-fail  Always       -       119133
  2 Throughput_Performance  0x0005   100   100   030    Pre-fail  Offline      -       22478848
  3 Spin_Up_Time            0x0003   100   100   025    Pre-fail  Always       -       1
  4 Start_Stop_Count        0x0032   099   099   000    Old_age   Always       -       1092
  5 Reallocated_Sector_Ct   0x0033   100   100   024    Pre-fail  Always       -       0 (2000 0)
  7 Seek_Error_Rate         0x000f   100   100   047    Pre-fail  Always       -       2923
  8 Seek_Time_Performance   0x0005   100   100   019    Pre-fail  Offline      -       0
  9 Power_On_Minutes        0x0032   089   089   000    Old_age   Always       -       97h+28m
 10 Spin_Retry_Count        0x0013   100   100   020    Pre-fail  Always       -       0
 12 Power_Cycle_Count       0x0032   100   100   000    Old_age   Always       -       1046
192 Power-Off_Retract_Count 0x0032   100   100   000    Old_age   Always       -       76
193 Load_Cycle_Count        0x0032   098   098   000    Old_age   Always       -       46878
194 Temperature_Celsius     0x0022   100   100   000    Old_age   Always       -       23 (Min/Max 5/53)
195 Hardware_ECC_Recovered  0x001a   100   100   000    Old_age   Always       -       488
196 Reallocated_Event_Count 0x0032   100   100   000    Old_age   Always       -       0 (0 6985)
197 Current_Pending_Sector  0x0012   100   100   000    Old_age   Always       -       0
198 Offline_Uncorrectable   0x0010   100   100   000    Old_age   Offline      -       0
199 UDMA_CRC_Error_Count    0x003e   200   253   000    Old_age   Always       -       0
200 Multi_Zone_Error_Rate   0x000f   100   100   060    Pre-fail  Always       -       27671
203 Run_Out_Cancel          0x0002   100   100   000    Old_age   Always       -       433769807259
240 Head_Flying_Hours       0x003e   200   200   000    Old_age   Always       -       0

SMART Error Log Version: 1
No Errors Logged

SMART Self-test log structure revision number 1
Num  Test_Description    Status                  Remaining  LifeTime(hours)  LBA_of_first_error
# 1  Vendor (0x50)       Completed without error       00%         0         -

SMART Selective self-test log data structure revision number 1
 SPAN  MIN_LBA  MAX_LBA  CURRENT_TEST_STATUS
    1        0        0  Not_testing
    2        0        0  Not_testing
    3        0        0  Not_testing
    4        0        0  Not_testing
    5        0        0  Not_testing
Selective self-test flags (0x0):
  After scanning selected spans, do NOT read-scan remainder of disk.
If Selective self-test is pending on power-up, resume after 0 minute delay.

