smartctl 6.5 2016-01-24 r4214 [x86_64-linux-4.4.0-31-generic] (local build)
Copyright (C) 2002-16, Bruce Allen, Christian Franke, www.smartmontools.org

=== START OF INFORMATION SECTION ===
Model Family:     Seagate Momentus 7200.4
Device Model:     ST9320423AS
Serial Number:    5VH2KJ35
LU WWN Device Id: 5 000c50 024f0c769
Firmware Version: 0003LVM1
User Capacity:    320,072,933,376 bytes [320 GB]
Sector Size:      512 bytes logical/physical
Rotation Rate:    7200 rpm
Device is:        In smartctl database [for details use: -P show]
ATA Version is:   ATA8-ACS T13/1699-D revision 4
SATA Version is:  SATA 2.6, 3.0 Gb/s (current: 3.0 Gb/s)
Local Time is:    Fri Dec  9 16:09:57 2016 CET
SMART support is: Available - device has SMART capability.
SMART support is: Enabled

=== START OF READ SMART DATA SECTION ===
SMART overall-health self-assessment test result: PASSED
See vendor-specific Attribute list for marginal Attributes.

General SMART Values:
Offline data collection status:  (0x82)	Offline data collection activity
					was completed without error.
					Auto Offline Data Collection: Enabled.
Self-test execution status:      (   0)	The previous self-test routine completed
					without error or no self-test has ever 
					been run.
Total time to complete Offline 
data collection: 		(    0) seconds.
Offline data collection
capabilities: 			 (0x7b) SMART execute Offline immediate.
					Auto Offline data collection on/off support.
					Suspend Offline collection upon new
					command.
					Offline surface scan supported.
					Self-test supported.
					Conveyance Self-test supported.
					Selective Self-test supported.
SMART capabilities:            (0x0003)	Saves SMART data before entering
					power-saving mode.
					Supports SMART auto save timer.
Error logging capability:        (0x01)	Error logging supported.
					General Purpose Logging supported.
Short self-test routine 
recommended polling time: 	 (   1) minutes.
Extended self-test routine
recommended polling time: 	 (  78) minutes.
Conveyance self-test routine
recommended polling time: 	 (   2) minutes.
SCT capabilities: 	       (0x103b)	SCT Status supported.
					SCT Error Recovery Control supported.
					SCT Feature Control supported.
					SCT Data Table supported.

SMART Attributes Data Structure revision number: 10
Vendor Specific SMART Attributes with Thresholds:
ID# ATTRIBUTE_NAME          FLAG     VALUE WORST THRESH TYPE      UPDATED  WHEN_FAILED RAW_VALUE
  1 Raw_Read_Error_Rate     0x000f   118   099   034    Pre-fail  Always       -       187302267
  3 Spin_Up_Time            0x0003   100   100   000    Pre-fail  Always       -       0
  4 Start_Stop_Count        0x0032   099   099   020    Old_age   Always       -       1046
  5 Reallocated_Sector_Ct   0x0033   100   100   036    Pre-fail  Always       -       0
  7 Seek_Error_Rate         0x000f   078   060   030    Pre-fail  Always       -       8742974124
  9 Power_On_Hours          0x0032   092   092   000    Old_age   Always       -       7586 (158 144 0)
 10 Spin_Retry_Count        0x0013   100   100   097    Pre-fail  Always       -       0
 12 Power_Cycle_Count       0x0032   099   099   020    Old_age   Always       -       1038
184 End-to-End_Error        0x0032   100   100   099    Old_age   Always       -       0
187 Reported_Uncorrect      0x0032   100   100   000    Old_age   Always       -       0
188 Command_Timeout         0x0032   100   100   000    Old_age   Always       -       0
189 High_Fly_Writes         0x003a   100   100   000    Old_age   Always       -       0
190 Airflow_Temperature_Cel 0x0022   082   035   045    Old_age   Always   In_the_past 18 (0 16 18 16 0)
191 G-Sense_Error_Rate      0x0032   100   100   000    Old_age   Always       -       32
192 Power-Off_Retract_Count 0x0032   100   100   000    Old_age   Always       -       6
193 Load_Cycle_Count        0x0032   001   001   000    Old_age   Always       -       213733
194 Temperature_Celsius     0x0022   018   065   000    Old_age   Always       -       18 (0 14 0 0 0)
195 Hardware_ECC_Recovered  0x001a   058   048   000    Old_age   Always       -       187302267
196 Reallocated_Event_Count 0x000f   094   094   030    Pre-fail  Always       -       5770 (50968 0)
197 Current_Pending_Sector  0x0012   100   100   000    Old_age   Always       -       0
198 Offline_Uncorrectable   0x0010   100   100   000    Old_age   Offline      -       0
199 UDMA_CRC_Error_Count    0x003e   200   200   000    Old_age   Always       -       0
254 Free_Fall_Sensor        0x0032   100   100   000    Old_age   Always       -       0

SMART Error Log Version: 1
No Errors Logged

SMART Self-test log structure revision number 1
Num  Test_Description    Status                  Remaining  LifeTime(hours)  LBA_of_first_error
# 1  Vendor (0x50)       Completed without error       00%         0         -

SMART Selective self-test log data structure revision number 1
 SPAN  MIN_LBA  MAX_LBA  CURRENT_TEST_STATUS
    1        0        0  Not_testing
    2        0        0  Not_testing
    3        0        0  Not_testing
    4        0        0  Not_testing
    5        0        0  Not_testing
Selective self-test flags (0x0):
  After scanning selected spans, do NOT read-scan remainder of disk.
If Selective self-test is pending on power-up, resume after 0 minute delay.

smartctl 6.5 2016-01-24 r4214 [x86_64-linux-4.4.0-31-generic] (local build)
Copyright (C) 2002-16, Bruce Allen, Christian Franke, www.smartmontools.org

/dev/sdb: Unknown USB bridge [0x18a5:0x0302 (0x100)]
Please specify device type with the -d option.

Use smartctl -h to get a usage summary

smartctl 6.5 2016-01-24 r4214 [x86_64-linux-4.4.0-31-generic] (local build)
Copyright (C) 2002-16, Bruce Allen, Christian Franke, www.smartmontools.org

=== START OF INFORMATION SECTION ===
Vendor:               Verbatim
Product:              STORE N GO
Revision:             PMAP
User Capacity:        7,746,879,488 bytes [7.74 GB]
Logical block size:   512 bytes
scsiModePageOffset: response length too short, resp_len=4 offset=4 bd_len=0
scsiModePageOffset: response length too short, resp_len=4 offset=4 bd_len=0
>> Terminate command early due to bad response to IEC mode page
A mandatory SMART command failed: exiting. To continue, add one or more '-T permissive' options.
smartctl 6.5 2016-01-24 r4214 [x86_64-linux-4.4.0-31-generic] (local build)
Copyright (C) 2002-16, Bruce Allen, Christian Franke, www.smartmontools.org

=== START OF INFORMATION SECTION ===
Vendor:               Verbatim
Product:              STORE N GO
Revision:             PMAP
User Capacity:        7,746,879,488 bytes [7.74 GB]
Logical block size:   512 bytes
scsiModePageOffset: response length too short, resp_len=4 offset=4 bd_len=0
scsiModePageOffset: response length too short, resp_len=4 offset=4 bd_len=0
>> Terminate command early due to bad response to IEC mode page
A mandatory SMART command failed: exiting. To continue, add one or more '-T permissive' options.
smartctl 6.5 2016-01-24 r4214 [x86_64-linux-4.4.0-31-generic] (local build)
Copyright (C) 2002-16, Bruce Allen, Christian Franke, www.smartmontools.org

=== START OF INFORMATION SECTION ===
Vendor:               Verbatim
Product:              STORE N GO
Revision:             PMAP
User Capacity:        7,746,879,488 bytes [7.74 GB]
Logical block size:   512 bytes
scsiModePageOffset: response length too short, resp_len=4 offset=4 bd_len=0
scsiModePageOffset: response length too short, resp_len=4 offset=4 bd_len=0
>> Terminate command early due to bad response to IEC mode page
A mandatory SMART command failed: exiting. To continue, add one or more '-T permissive' options.
